{
  "schema_version": "1.0.0",
  "projeto": {
    "nome": "Ocarina of Time DSi",
    "descricao": "Adaptação experimental nativa de The Legend of Zelda: Ocarina of Time para Nintendo DSi, em desenvolvimento. O 3D usa o geometry engine do DS; a matemática é em ponto fixo porque o ARM9 não tem FPU.",
    "alvo": "TWiLight Menu++ / nds-bootstrap em modo DSi, sem FPU (matemática em ponto fixo no ARM9)",
    "base_de_codigo": "Decompilação zeldaret/oot em C, embutida em game/oot e pinada no commit 14759abf9abb4295de142cdc1452998630ea70fb; adaptações próprias em source/gfx, source/nds, source/ui e source/main.c.",
    "ambiente_medicao_padrao": "melonDS 1.1, modo DS, 67 MHz, janela 272x448, cartão SD emulado pelo DLDI FolderSync. Salvo indicação contrária, toda medida deste arquivo foi feita nesse ambiente.",
    "versionamento": "A árvore de trabalho não tem histórico git utilizável (nenhum commit registrado). Não existe número de versão do port; o identificador estável de cada entrega é o OTD-NNN.",
    "aviso_emulador": "Resultado de emulador não é medição de hardware físico. O portão de DSi real continua aberto para todas as entregas.",
    "codigo_de_terceiros": [
      {
        "nome": "zeldaret/oot",
        "papel": "Decompilação do jogo que fornece código de lógica, tipos, macros F3DEX2 e tabelas; é a base integrada, não código próprio do port.",
        "versao_ou_referencia": "commit 14759abf9abb4295de142cdc1452998630ea70fb (main, 2026-10-18)",
        "licenca": "ver repositório de origem; nenhum asset extraído é redistribuído por este projeto"
      },
      {
        "nome": "devkitARM / libnds / libfat / maxmod / Calico",
        "papel": "Toolchain e bibliotecas de plataforma do DS.",
        "versao_ou_referencia": "devkitARM r68-1 (GCC 16.1.0), libnds 2.0.2, binutils 2.46.0, ndstool 2.3.1, Calico 1.2.0",
        "licenca": "ver pacotes dkp-libs/dkp-windows"
      },
      {
        "nome": "melonDS",
        "papel": "Emulador usado para todas as validações registradas.",
        "versao_ou_referencia": "1.1",
        "licenca": "GPLv3"
      }
    ],
    "creditos": [
      {
        "nome": "zeldaret/oot",
        "papel": "decompilação em C integrada como base de código do jogo",
        "versao_ou_referencia": "commit 14759abf9abb4295de142cdc1452998630ea70fb (main, 2026-10-18)",
        "licenca": "licença do repositório de origem"
      },
      {
        "nome": "source/gfx",
        "papel": "código próprio do port: decodificador F3DEX2, tradução para o geometry engine, texturas, cache, combiner, viewport, recorte e seleção de mip",
        "versao_ou_referencia": "árvore local sem identificador de versão",
        "licenca": "licença declarada na raiz do projeto, quando houver"
      },
      {
        "nome": "source/nds, source/ui, source/main.c",
        "papel": "código próprio do port: plataforma, tempo, escalonador, memória, entrada, leitura de assets, telemetria e interface das duas telas",
        "versao_ou_referencia": "árvore local sem identificador de versão",
        "licenca": "licença declarada na raiz do projeto, quando houver"
      },
      {
        "nome": "ferramentas/",
        "papel": "código próprio: validação dos dados, geração da documentação, medidor de grão e recorte de captura",
        "versao_ou_referencia": "árvore local sem identificador de versão",
        "licenca": "licença declarada na raiz do projeto, quando houver"
      },
      {
        "nome": "devkitARM",
        "papel": "compilador e binutils para ARM9",
        "versao_ou_referencia": "r68-1 (GCC 16.1.0), binutils 2.46.0",
        "licenca": "licença do devkitPro"
      },
      {
        "nome": "libnds",
        "papel": "vídeo, interrupções, timers e console do DS",
        "versao_ou_referencia": "2.0.2",
        "licenca": "licença do devkitPro"
      },
      {
        "nome": "libfat / DLDI",
        "papel": "leitura do cartão SD no DS e [DLDI] FolderSync no emulador",
        "versao_ou_referencia": "pacote dkp",
        "licenca": "licença do devkitPro"
      },
      {
        "nome": "maxmod",
        "papel": "áudio (ainda não integrado ao jogo)",
        "versao_ou_referencia": "pacote dkp",
        "licenca": "licença do devkitPro"
      },
      {
        "nome": "Calico",
        "papel": "runtime de suporte do devkitPro",
        "versao_ou_referencia": "1.2.0",
        "licenca": "licença do devkitPro"
      },
      {
        "nome": "ndstool",
        "papel": "empacotamento do .nds",
        "versao_ou_referencia": "2.3.1",
        "licenca": "licença do devkitPro"
      },
      {
        "nome": "melonDS",
        "papel": "emulador usado em todas as validações; não é distribuído com o projeto",
        "versao_ou_referencia": "1.1",
        "licenca": "licença do projeto melonDS"
      }
    ],
    "aviso_de_marca": "The Legend of Zelda e Ocarina of Time são marcas da Nintendo. Este é um projeto de engenharia independente, sem afiliação com a Nintendo.",
    "aviso_de_assets": "Nenhuma cópia de referência, arquivo extraído do jogo ou tabela de assets é distribuído com este site. As capturas são evidência técnica do port em execução."
  },
  "estados": {
    "planejado": {
      "rotulo": "Planejado",
      "descricao": "Escopo definido; nenhum código da entrega foi escrito."
    },
    "em_implementacao": {
      "rotulo": "Em implementação",
      "descricao": "Código em andamento; nenhuma medição fechada."
    },
    "implementado": {
      "rotulo": "Implementado",
      "descricao": "Compila e roda, mas não passou por teste registrado na condição real de uso."
    },
    "testado_computador": {
      "rotulo": "Testado no computador",
      "descricao": "Validado por autoteste ou verificação fora do DS (por exemplo, no host)."
    },
    "testado_emulador": {
      "rotulo": "Testado em emulador",
      "descricao": "Validado no melonDS 1.1 em modo DS, com evidência registrada. Não é hardware físico."
    },
    "testado_hardware": {
      "rotulo": "Testado em hardware físico",
      "descricao": "Validado em DSi real via TWiLight Menu++ / nds-bootstrap. Nenhuma entrega chegou aqui."
    },
    "parcial_bloqueado_regressao": {
      "rotulo": "Parcial, bloqueado ou com regressão conhecida",
      "descricao": "Entrega incompleta, impedida por dependência externa ou com defeito conhecido registrado."
    }
  },
  "ambiente_padrao": {
    "emulador": "melonDS 1.1",
    "modo": "DS mode",
    "clock_mhz": 67,
    "janela": "272x448; painel 3D em X 8, Y 56, 256x192",
    "hardware_fisico": false,
    "observacao": "Todas as entregas registradas foram validadas em emulador; nenhuma foi validada em DSi físico."
  },
  "medicoes_definicoes": [
    {
      "chave": "fps",
      "nome": "FPS exibido",
      "definicao": "Quadros terminados dentro da última janela de 1 segundo do relógio de barramento (BUS_CLOCK), impresso na linha 8 da consola e atualizado no ecrã a 4 Hz.",
      "como_medido": "perfEnd incrementa framesInSec a cada iteração; quando now − secondStart ≥ BUS_CLOCK, fps = framesInSec e a contagem recomeça. Cada iteração termina em swiWaitForVBlank(), então o valor não passa de 60 e é sempre inteiro.",
      "limitacoes": "É um inteiro por janela, não uma média histórica; esconde variação dentro da janela e diferenças abaixo de 1 FPS. É o FPS do loop no emulador, não uma garantia no DSi real."
    },
    {
      "chave": "taxa_simulacao_hz",
      "nome": "Taxa de simulação",
      "definicao": "Ticks de lógica do jogo por segundo, independentes do desenho.",
      "como_medido": "Contador incrementado por IRQ de VBlank e convertido em ticks de 3 quadros (20 Hz); a taxa real é recalculada a cada segundo.",
      "limitacoes": "Mede o escalonador, não o custo de render; um quadro perdido devolve mais de um tick e esconde a queda de FPS."
    },
    {
      "chave": "tempo_quadro_ms",
      "nome": "Tempo de quadro (f)",
      "definicao": "Intervalo entre duas chamadas consecutivas a perfEnd, ou seja a última iteração inteira do loop: entrada, render, texto do HUD, lógica e espera de VBlank.",
      "como_medido": "timeTicks() no fim de cada iteração, subtraído do anterior antes da conversão para microssegundos; impresso como f na linha 8. É a última iteração, não a média.",
      "limitacoes": "É o período do loop, não o tempo de GPU; inclui telemetria, lógica e a espera de VBlank. Não é comparável entre sessões sem um par A/B da mesma rodada. O recorde de f desde o boot é impresso como w: é marca d'água, não o custo atual, e inclui os quadros de carregamento."
    },
    {
      "chave": "tempo_render_ms",
      "nome": "Tempo de render (s)",
      "definicao": "Tempo de CPU entre o início da montagem da cena e a submissão completa da display list ao geometry engine.",
      "como_medido": "Par de leituras do timer de hardware em volta de geDrawList; impresso como s na linha 8.",
      "limitacoes": "Não inclui o rasterizador: o custo de preenchimento de pixel não aparece aqui. É a métrica usada nas comparações A/B de otimização do motor."
    },
    {
      "chave": "tempo_submissao_ms",
      "nome": "Tempo de submissão",
      "definicao": "Parcela do tempo de render gasta em chamadas de envio ao GE (matrizes, vértices, texturas).",
      "como_medido": "Acumulador das chamadas de submissão dentro do render; foi o indicador que expôs a espera de 236 ms por polls de MMIO.",
      "limitacoes": "No emulador, cada acesso a MMIO tem custo diferente do hardware; serve para comparar builds, não para prever o DSi real."
    },
    {
      "chave": "grao",
      "nome": "Grão do painel (métrica própria)",
      "definicao": "Média do módulo da diferença de luminância entre pixels vizinhos horizontais no painel 3D (indicador de ruído de alta frequência). Não é uma medida de cor.",